{
  "schema_version": "1.0",
  "corpus_id": "foundation-v4-activation-heldout",
  "split": "heldout",
  "candidate_independent": true,
  "routing_surface": "fixed-four-adviser",
  "reference_catalog": ["architecture-boundary", "decision-contract", "verification-evidence", "learning-adoption", "decomposition-boundary", "no-change-abstention", "reference-isolation"],
  "cases": [
    {"id":"AQ-H-001","family_id":"h-decomp-medical-review","category":"decomposition","mode":"automatic","prompt":"A clinical summarizer extracts facts, drafts a note, and asks a reviewer to sign. Identify the smallest ownership layout that preserves accountable review.","authority":{"effect_authority":false,"claim_authority":false},"condition_blind":true,"labels_visible_to_runner":false,"outcomes_visible_to_authoring":false,"hidden_labels":{"expected_advisers":["agentic-engineering"],"must_not_select":[],"reference_triggers":["architecture-boundary","decomposition-boundary"]},"near_neighbor_kind":null,"declared_invocation":null},
    {"id":"AQ-H-002","family_id":"h-decomp-order-state","category":"decomposition","mode":"automatic","prompt":"A commerce helper checks inventory, proposes substitutions, and may reserve stock. Separate the decisions that need one durable source of truth from simple advice.","authority":{"effect_authority":false,"claim_authority":false},"condition_blind":true,"labels_visible_to_runner":false,"outcomes_visible_to_authoring":false,"hidden_labels":{"expected_advisers":["agentic-engineering"],"must_not_select":[],"reference_triggers":["architecture-boundary","decomposition-boundary"]},"near_neighbor_kind":null,"declared_invocation":null},
    {"id":"AQ-H-003","family_id":"h-decomp-investigation-handoff","category":"decomposition","mode":"automatic","prompt":"A helper summarizes a changing situation, suggests a next step, and hands a proposal to an owner. Design boundaries so that a handoff cannot silently become an action.","authority":{"effect_authority":false,"claim_authority":false},"condition_blind":true,"labels_visible_to_runner":false,"outcomes_visible_to_authoring":false,"hidden_labels":{"expected_advisers":["agentic-engineering"],"must_not_select":[],"reference_triggers":["architecture-boundary","reference-isolation"]},"near_neighbor_kind":null,"declared_invocation":null},
    {"id":"AQ-H-004","family_id":"h-decomp-dispute-resolution","category":"decomposition","mode":"automatic","prompt":"A dispute workflow classifies evidence, recommends an outcome, and records a final disposition. Decide which component owns each material decision and why.","authority":{"effect_authority":false,"claim_authority":false},"condition_blind":true,"labels_visible_to_runner":false,"outcomes_visible_to_authoring":false,"hidden_labels":{"expected_advisers":["agentic-engineering"],"must_not_select":[],"reference_triggers":["architecture-boundary","decomposition-boundary"]},"near_neighbor_kind":null,"declared_invocation":null},
    {"id":"AQ-H-005","family_id":"h-decomp-policy-retrieval","category":"decomposition","mode":"automatic","prompt":"A policy assistant retrieves changing rules, makes a recommendation, and submits a request for approval. Choose the minimal topology that keeps retrieved text from becoming authority.","authority":{"effect_authority":false,"claim_authority":false},"condition_blind":true,"labels_visible_to_runner":false,"outcomes_visible_to_authoring":false,"hidden_labels":{"expected_advisers":["agentic-engineering"],"must_not_select":[],"reference_triggers":["architecture-boundary","reference-isolation"]},"near_neighbor_kind":null,"declared_invocation":null},
    {"id":"AQ-H-006","family_id":"h-decomp-parallel-audit","category":"decomposition","mode":"automatic","prompt":"One review process compares two reports, then a named owner selects the final conclusion. Specify a boundary that prevents an accumulated opinion from becoming proof.","authority":{"effect_authority":false,"claim_authority":false},"condition_blind":true,"labels_visible_to_runner":false,"outcomes_visible_to_authoring":false,"hidden_labels":{"expected_advisers":["agentic-engineering"],"must_not_select":[],"reference_triggers":["architecture-boundary","decomposition-boundary"]},"near_neighbor_kind":null,"declared_invocation":null},
    {"id":"AQ-H-007","family_id":"h-contract-cli-rewrite","category":"task-contract","mode":"automatic","prompt":"A request says to modernize a command-line tool before a demo. Define a work contract that exposes scope, compatibility, prohibited changes, and evidence.","authority":{"effect_authority":false,"claim_authority":false},"condition_blind":true,"labels_visible_to_runner":false,"outcomes_visible_to_authoring":false,"hidden_labels":{"expected_advisers":["codex-task-contract"],"must_not_select":[],"reference_triggers":["decision-contract"]},"near_neighbor_kind":null,"declared_invocation":null},
    {"id":"AQ-H-008","family_id":"h-contract-vendor-import","category":"task-contract","mode":"automatic","prompt":"A product owner wants an external data import enabled quickly. State the objective, exact target, irreversible boundaries, and acceptance criteria before implementation.","authority":{"effect_authority":false,"claim_authority":false},"condition_blind":true,"labels_visible_to_runner":false,"outcomes_visible_to_authoring":false,"hidden_labels":{"expected_advisers":["codex-task-contract"],"must_not_select":[],"reference_triggers":["decision-contract","reference-isolation"]},"near_neighbor_kind":null,"declared_invocation":null},
    {"id":"AQ-H-009","family_id":"h-contract-schema-change","category":"task-contract","mode":"automatic","prompt":"A team wants a schema cleanup but has mixed backward compatibility wishes with no stated owner for migration decisions. Write the decision-complete brief.","authority":{"effect_authority":false,"claim_authority":false},"condition_blind":true,"labels_visible_to_runner":false,"outcomes_visible_to_authoring":false,"hidden_labels":{"expected_advisers":["codex-task-contract"],"must_not_select":[],"reference_triggers":["decision-contract"]},"near_neighbor_kind":null,"declared_invocation":null},
    {"id":"AQ-H-010","family_id":"h-contract-access-review","category":"task-contract","mode":"automatic","prompt":"Turn a request to tighten access into a bounded task that names affected users, non-goals, approval requirements, and required proof.","authority":{"effect_authority":false,"claim_authority":false},"condition_blind":true,"labels_visible_to_runner":false,"outcomes_visible_to_authoring":false,"hidden_labels":{"expected_advisers":["codex-task-contract"],"must_not_select":[],"reference_triggers":["decision-contract","reference-isolation"]},"near_neighbor_kind":null,"declared_invocation":null},
    {"id":"AQ-H-011","family_id":"h-contract-old-dependency","category":"task-contract","mode":"automatic","prompt":"An issue says to replace an old dependency because it feels risky. Frame the exact deliverable, evidence needed, and assumptions that may be safely deferred.","authority":{"effect_authority":false,"claim_authority":false},"condition_blind":true,"labels_visible_to_runner":false,"outcomes_visible_to_authoring":false,"hidden_labels":{"expected_advisers":["codex-task-contract"],"must_not_select":[],"reference_triggers":["decision-contract"]},"near_neighbor_kind":null,"declared_invocation":null},
    {"id":"AQ-H-012","family_id":"h-contract-automation-request","category":"task-contract","mode":"automatic","prompt":"A manager asks for an automated weekly report with no recipient, source of truth, delivery channel, or failure behavior. Establish a decision-ready contract.","authority":{"effect_authority":false,"claim_authority":false},"condition_blind":true,"labels_visible_to_runner":false,"outcomes_visible_to_authoring":false,"hidden_labels":{"expected_advisers":["codex-task-contract"],"must_not_select":[],"reference_triggers":["decision-contract","no-change-abstention"]},"near_neighbor_kind":null,"declared_invocation":null},
    {"id":"AQ-H-013","family_id":"h-verify-token-revocation","category":"verification","mode":"automatic","prompt":"A token revocation change is said to take effect immediately. Identify the observations that would expose cached or concurrent access paths.","authority":{"effect_authority":false,"claim_authority":false},"condition_blind":true,"labels_visible_to_runner":false,"outcomes_visible_to_authoring":false,"hidden_labels":{"expected_advisers":["verification-strategy-engineering"],"must_not_select":[],"reference_triggers":["verification-evidence"]},"near_neighbor_kind":null,"declared_invocation":null},
    {"id":"AQ-H-014","family_id":"h-verify-build-inputs","category":"verification","mode":"automatic","prompt":"A build job reports reproducibility across two machines. Plan the evidence needed to distinguish identical outputs from coincidental success logs.","authority":{"effect_authority":false,"claim_authority":false},"condition_blind":true,"labels_visible_to_runner":false,"outcomes_visible_to_authoring":false,"hidden_labels":{"expected_advisers":["verification-strategy-engineering"],"must_not_select":[],"reference_triggers":["verification-evidence","reference-isolation"]},"near_neighbor_kind":null,"declared_invocation":null},
    {"id":"AQ-H-015","family_id":"h-verify-retry-boundary","category":"verification","mode":"automatic","prompt":"A message sender retries after timeouts and claims it never duplicates delivery. Choose an oracle that covers ambiguous completion and recovery.","authority":{"effect_authority":false,"claim_authority":false},"condition_blind":true,"labels_visible_to_runner":false,"outcomes_visible_to_authoring":false,"hidden_labels":{"expected_advisers":["verification-strategy-engineering"],"must_not_select":[],"reference_triggers":["verification-evidence"]},"near_neighbor_kind":null,"declared_invocation":null},